{"candidate_id":"V2-C021","spec_hash":"8e10fa83d33dfa69aa463cd1ead657a03b0f1d02cb7f68ab40fcacf4629dfa06","stage":"A","status":"GROSS_EDGE_FAIL","implementation_validity":{"state":"VALID","reason":"Frozen causal M5 evaluator and exact capture/cost gates passed."},"metrics":{"event_count":1286,"gross_pnl":-109.38014399619384,"coarse_net_pnl":-320.6943537921307,"gross_return":-0.00008505454432052397,"coarse_net_return":-0.000249373525499324,"gross_per_event":-0.08505454432052398,"net_per_event":-0.24937352549932404,"cost_burden":0.00016431898117880248,"turnover":2572000.0,"weekly_events":{"2026-W25":95,"2026-W26":100,"2026-W27":96,"2026-W28":100,"2026-W29":100,"2026-W30":100,"2026-W31":100,"2026-W32":100,"2026-W33":100,"2026-W34":100,"2026-W35":100,"2026-W36":100,"2026-W37":95},"active_weeks":13,"longest_inactive_gap":3,"weekday_distribution":{"MON":255,"TUE":260,"WED":260,"THU":260,"FRI":239,"SAT":0,"SUN":12},"session_distribution":{"UTC_00_03":194,"UTC_03_06":195,"UTC_06_09":194,"UTC_09_12":131,"UTC_12_15":195,"UTC_15_18":189,"UTC_18_21":124,"UTC_21_00":64},"hold_duration":{"min_minutes":60.0,"median_minutes":60.0,"mean_minutes":60.0,"max_minutes":60.0},"exposure":0.5888278388278388,"drawdown":327.1652945646044,"symbol_contribution":{"US2000":{"event_count":1286,"gross_pnl_eur":-109.38014399619384,"transaction_cost_eur":211.31420979593997,"coarse_net_pnl_eur":-320.6943537921307}},"direction_contribution":{"LONG_US2000":{"event_count":668,"gross_pnl_eur":-37.21208091472422,"transaction_cost_eur":109.76507942743756,"coarse_net_pnl_eur":-146.97716034216288},"SHORT_US2000":{"event_count":618,"gross_pnl_eur":-72.1680630814695,"transaction_cost_eur":101.54913036849781,"coarse_net_pnl_eur":-173.71719344996805}},"subperiod_contribution":{"EARLY_9W":{"event_count":891,"gross_pnl_eur":-60.37961661041786,"transaction_cost_eur":146.4082122303104,"coarse_net_pnl_eur":-206.7878288407288},"LATEST_4W":{"event_count":395,"gross_pnl_eur":-49.000527385775825,"transaction_cost_eur":64.90599756562656,"coarse_net_pnl_eur":-113.90652495140189}},"regime_contribution":{"state":"NOT_APPLICABLE","reason":"No prospectively frozen regime taxonomy in Wave 01."}},"eur200_feasibility":{"state":"NOT_EVALUATED","reason":"Stage A fixed EUR1000 analytic normalization; exact shared EUR200 replay requires survivor Stage-B volume lattice and causal margin."},"cost_confidence":{"state":"CONSERVATIVE_BOUND","reason":"Outcome-blind p75 across sampled-window p95 effective roundtrip friction fractions."},"data_completeness":{"state":"SUFFICIENT","reason":"Accepted V6 13-week M5 capture with explicit pagination exhaustion and checksum binding."},"provenance":{"data_evidence":{"identity":"MXM_COMPETITION_ULTRA_FAST_STAGE_A_V6","binding":{"type":"DATASET_SHA256","sha256":"dd0736c3156abfa057303a9b2a31ef3db36b02d66afc5fa33ddccc7f416f5d3d"}},"cost_evidence":{"identity":"COMPETITION_ULTRA_FAST_STAGE_A_COARSE_COST_AUTHORITY_V1","state":"CONSERVATIVE_BOUND","sha256":"b7ca6191b5570c1cc22f644feb6b0124c6bec0f00fc5ad5a8c772419bcb481b9"},"evaluator":{"version":"MXM_COMPETITION_ULTRA_FAST_STAGE_A_EVALUATOR_V1","sha256":"b9b8fdecd7b415116149e611ff09961fe92793c66ec3d42796afa12946a46c6d"}},"result_hash":"ab2b23edb01a913cc2aace95591bf004d6458cc3b3d254eca26625d211e5d1a2"}
