{
  "candidate_id": "V2-C025",
  "cost_confidence": {
    "reason": "Unchanged pre-outcome V6 per-symbol coarse roundtrip cost authority.",
    "state": "CONSERVATIVE_BOUND"
  },
  "data_completeness": {
    "reason": "3 causally admitted C025 entries lack the exact post-entry contiguous target grid required by the frozen exit semantics; they cannot be retroactively suppressed or economically settled from this DEVELOPMENT corpus.",
    "state": "INSUFFICIENT"
  },
  "eur200_feasibility": {
    "reason": "Stage A cannot promote while corrected settlement data are insufficient.",
    "state": "NOT_EVALUATED"
  },
  "implementation_validity": {
    "reason": "Live-equivalent admission correction passed; future target availability is never queried before entry.",
    "state": "VALID"
  },
  "metrics": {
    "active_weeks": {
      "reason": "3 causally admitted C025 entries lack the exact post-entry contiguous target grid required by the frozen exit semantics; they cannot be retroactively suppressed or economically settled from this DEVELOPMENT corpus.",
      "state": "UNAVAILABLE"
    },
    "coarse_net_pnl": {
      "reason": "3 causally admitted C025 entries lack the exact post-entry contiguous target grid required by the frozen exit semantics; they cannot be retroactively suppressed or economically settled from this DEVELOPMENT corpus.",
      "state": "UNAVAILABLE"
    },
    "coarse_net_return": {
      "reason": "3 causally admitted C025 entries lack the exact post-entry contiguous target grid required by the frozen exit semantics; they cannot be retroactively suppressed or economically settled from this DEVELOPMENT corpus.",
      "state": "UNAVAILABLE"
    },
    "cost_burden": {
      "reason": "3 causally admitted C025 entries lack the exact post-entry contiguous target grid required by the frozen exit semantics; they cannot be retroactively suppressed or economically settled from this DEVELOPMENT corpus.",
      "state": "UNAVAILABLE"
    },
    "direction_contribution": {
      "reason": "3 causally admitted C025 entries lack the exact post-entry contiguous target grid required by the frozen exit semantics; they cannot be retroactively suppressed or economically settled from this DEVELOPMENT corpus.",
      "state": "UNAVAILABLE"
    },
    "drawdown": {
      "reason": "3 causally admitted C025 entries lack the exact post-entry contiguous target grid required by the frozen exit semantics; they cannot be retroactively suppressed or economically settled from this DEVELOPMENT corpus.",
      "state": "UNAVAILABLE"
    },
    "event_count": {
      "reason": "3 causally admitted C025 entries lack the exact post-entry contiguous target grid required by the frozen exit semantics; they cannot be retroactively suppressed or economically settled from this DEVELOPMENT corpus.",
      "state": "UNAVAILABLE"
    },
    "exposure": {
      "reason": "3 causally admitted C025 entries lack the exact post-entry contiguous target grid required by the frozen exit semantics; they cannot be retroactively suppressed or economically settled from this DEVELOPMENT corpus.",
      "state": "UNAVAILABLE"
    },
    "gross_per_event": {
      "reason": "3 causally admitted C025 entries lack the exact post-entry contiguous target grid required by the frozen exit semantics; they cannot be retroactively suppressed or economically settled from this DEVELOPMENT corpus.",
      "state": "UNAVAILABLE"
    },
    "gross_pnl": {
      "reason": "3 causally admitted C025 entries lack the exact post-entry contiguous target grid required by the frozen exit semantics; they cannot be retroactively suppressed or economically settled from this DEVELOPMENT corpus.",
      "state": "UNAVAILABLE"
    },
    "gross_return": {
      "reason": "3 causally admitted C025 entries lack the exact post-entry contiguous target grid required by the frozen exit semantics; they cannot be retroactively suppressed or economically settled from this DEVELOPMENT corpus.",
      "state": "UNAVAILABLE"
    },
    "hold_duration": {
      "reason": "3 causally admitted C025 entries lack the exact post-entry contiguous target grid required by the frozen exit semantics; they cannot be retroactively suppressed or economically settled from this DEVELOPMENT corpus.",
      "state": "UNAVAILABLE"
    },
    "longest_inactive_gap": {
      "reason": "3 causally admitted C025 entries lack the exact post-entry contiguous target grid required by the frozen exit semantics; they cannot be retroactively suppressed or economically settled from this DEVELOPMENT corpus.",
      "state": "UNAVAILABLE"
    },
    "net_per_event": {
      "reason": "3 causally admitted C025 entries lack the exact post-entry contiguous target grid required by the frozen exit semantics; they cannot be retroactively suppressed or economically settled from this DEVELOPMENT corpus.",
      "state": "UNAVAILABLE"
    },
    "regime_contribution": {
      "reason": "3 causally admitted C025 entries lack the exact post-entry contiguous target grid required by the frozen exit semantics; they cannot be retroactively suppressed or economically settled from this DEVELOPMENT corpus.",
      "state": "UNAVAILABLE"
    },
    "session_distribution": {
      "reason": "3 causally admitted C025 entries lack the exact post-entry contiguous target grid required by the frozen exit semantics; they cannot be retroactively suppressed or economically settled from this DEVELOPMENT corpus.",
      "state": "UNAVAILABLE"
    },
    "subperiod_contribution": {
      "reason": "3 causally admitted C025 entries lack the exact post-entry contiguous target grid required by the frozen exit semantics; they cannot be retroactively suppressed or economically settled from this DEVELOPMENT corpus.",
      "state": "UNAVAILABLE"
    },
    "symbol_contribution": {
      "reason": "3 causally admitted C025 entries lack the exact post-entry contiguous target grid required by the frozen exit semantics; they cannot be retroactively suppressed or economically settled from this DEVELOPMENT corpus.",
      "state": "UNAVAILABLE"
    },
    "turnover": {
      "reason": "3 causally admitted C025 entries lack the exact post-entry contiguous target grid required by the frozen exit semantics; they cannot be retroactively suppressed or economically settled from this DEVELOPMENT corpus.",
      "state": "UNAVAILABLE"
    },
    "weekday_distribution": {
      "reason": "3 causally admitted C025 entries lack the exact post-entry contiguous target grid required by the frozen exit semantics; they cannot be retroactively suppressed or economically settled from this DEVELOPMENT corpus.",
      "state": "UNAVAILABLE"
    },
    "weekly_events": {
      "reason": "3 causally admitted C025 entries lack the exact post-entry contiguous target grid required by the frozen exit semantics; they cannot be retroactively suppressed or economically settled from this DEVELOPMENT corpus.",
      "state": "UNAVAILABLE"
    }
  },
  "provenance": {
    "cost_evidence": {
      "identity": "COMPETITION_ULTRA_FAST_STAGE_A_COARSE_COST_AUTHORITY_V1",
      "sha256": "b7ca6191b5570c1cc22f644feb6b0124c6bec0f00fc5ad5a8c772419bcb481b9",
      "state": "CONSERVATIVE_BOUND"
    },
    "data_evidence": {
      "binding": {
        "sha256": "dd0736c3156abfa057303a9b2a31ef3db36b02d66afc5fa33ddccc7f416f5d3d",
        "type": "DATASET_SHA256"
      },
      "identity": "MXM_COMPETITION_ULTRA_FAST_STAGE_A_V6"
    },
    "evaluator": {
      "sha256": "1b3ed935e9bdf51f22901d7666a49f11d5a65fd6ba95915b758116d69d6f97e0",
      "version": "MXM_SAME_IDENTITY_LIVE_EQUIVALENT_CORRECTION_V1"
    }
  },
  "spec_hash": "d357125ce183a2bd377c5c1b209e9ed7e382751042aa2b0162c6d88bd1efcf27",
  "stage": "A",
  "status": "DATA_INSUFFICIENT",
  "result_hash": "73f5c13fd72c118cf533430063351cef18060c3ac4e739c8b5e3b285a4bc9336"
}
